{
  "alerts": [
    {
      "alert_id": "e55fb0292bf3a34bd523ee4ea1d97858c8fded5f3075c3e0f2e16d8123338815",
      "arrived_late": true,
      "byte_delta": -9000,
      "category": "product",
      "detected_at": "2026-10-04T20:45:55Z",
      "edit_type": "edit",
      "editor_type": "unregistered",
      "edits_in_window": null,
      "event_ts": "2026-10-04T02:13:40Z",
      "log_action": null,
      "owner_team": "product-comms",
      "revision_new": 1000002,
      "revision_old": 1000001,
      "rule_id": "R2",
      "rule_name": "Large removal",
      "severity": "high",
      "title": "Ben & Jerry's",
      "wiki": "enwiki"
    },
    {
      "alert_id": "03ad6106cbf0a386e6e83060d6b6062f0be43d38da8de4c629cddf4a7d0e14e8",
      "arrived_late": true,
      "byte_delta": null,
      "category": "own_brand",
      "detected_at": "2026-10-04T20:45:55Z",
      "edit_type": "log",
      "editor_type": "registered",
      "edits_in_window": null,
      "event_ts": "2026-10-04T02:13:00Z",
      "log_action": "delete",
      "owner_team": "corporate-comms",
      "revision_new": null,
      "revision_old": null,
      "rule_id": "R1",
      "rule_name": "Page deleted or moved",
      "severity": "high",
      "title": "Unilever",
      "wiki": "enwiki"
    },
    {
      "alert_id": "cdedd74d169096eaa1c374d2d283ddf56cb1832d17b944e40ba43d7e55c2d372",
      "arrived_late": null,
      "byte_delta": null,
      "category": "product",
      "detected_at": "2026-10-04T20:46:35Z",
      "edit_type": null,
      "editor_type": null,
      "edits_in_window": 5,
      "event_ts": "2026-10-04T02:20:00Z",
      "log_action": null,
      "owner_team": "product-comms",
      "revision_new": null,
      "revision_old": null,
      "rule_id": "R5",
      "rule_name": "Edit burst",
      "severity": "medium",
      "title": "Marmite",
      "wiki": "enwiki"
    },
    {
      "alert_id": "58f5f19932adbd8f0175b68dfedcb7195a5d82986313d0c2f003ceab9f222cc4",
      "arrived_late": true,
      "byte_delta": -9000,
      "category": "product",
      "detected_at": "2026-10-04T20:45:55Z",
      "edit_type": "edit",
      "editor_type": "unregistered",
      "edits_in_window": null,
      "event_ts": "2026-10-04T02:13:40Z",
      "log_action": null,
      "owner_team": "product-comms",
      "revision_new": 1000002,
      "revision_old": 1000001,
      "rule_id": "R3",
      "rule_name": "Unregistered editor",
      "severity": "low",
      "title": "Ben & Jerry's",
      "wiki": "enwiki"
    },
    {
      "alert_id": "4f3175a272ff3116bf30c5e02b7834e4f5cc6272d687c8b19e07a4f115a765fc",
      "arrived_late": true,
      "byte_delta": null,
      "category": "own_brand",
      "detected_at": "2026-10-04T20:45:55Z",
      "edit_type": "log",
      "editor_type": "registered",
      "edits_in_window": null,
      "event_ts": "2026-10-04T02:13:20Z",
      "log_action": "protect",
      "owner_team": "corporate-comms",
      "revision_new": null,
      "revision_old": null,
      "rule_id": "R4",
      "rule_name": "Protection change",
      "severity": "low",
      "title": "Unilever",
      "wiki": "enwiki"
    }
  ],
  "digest": [
    {
      "bot_edits": 0,
      "category": "product",
      "digest_date": "2026-10-04",
      "edits": 9,
      "log_events": 0,
      "net_bytes": 360,
      "r1_alerts": 0,
      "r2_alerts": 0,
      "r3_alerts": 0,
      "r4_alerts": 0,
      "r5_alerts": 1,
      "registered_edits": 9,
      "title": "Marmite",
      "unregistered_edits": 0,
      "wiki": "enwiki"
    },
    {
      "bot_edits": 0,
      "category": "product",
      "digest_date": "2026-10-04",
      "edits": 1,
      "log_events": 0,
      "net_bytes": -9000,
      "r1_alerts": 0,
      "r2_alerts": 1,
      "r3_alerts": 1,
      "r4_alerts": 0,
      "r5_alerts": 0,
      "registered_edits": 0,
      "title": "Ben & Jerry's",
      "unregistered_edits": 1,
      "wiki": "enwiki"
    },
    {
      "bot_edits": 0,
      "category": "own_brand",
      "digest_date": "2026-10-04",
      "edits": 0,
      "log_events": 2,
      "net_bytes": 0,
      "r1_alerts": 1,
      "r2_alerts": 0,
      "r3_alerts": 0,
      "r4_alerts": 1,
      "r5_alerts": 0,
      "registered_edits": 0,
      "title": "Unilever",
      "unregistered_edits": 0,
      "wiki": "enwiki"
    }
  ],
  "generated_at": "2026-10-04T02:46:00Z",
  "schema_version": 1,
  "window_days": 7
}
